question|answer
Apa itu type data?|Sebuah tipe data yang berisi kumpulan data
Apa itu tipe data dasar?|Sebuah tipe data yang berisi data dasar
Apa itu tipe data non-dasar?|Sebuah tipe data yang berisi data non-dasar
Apa itu tipe data built-in?|Sebuah tipe data yang sudah ada
Apa itu tipe data non-built-in?|Sebuah tipe data yang dibuat sendiri
Apa saja tipe data dasar pada go-lang?|Integer; string; float; boolean; complex
Apa type data dengan bilangan bulat?|Integer
Apa type data dengan bilangan desimal?|Float
Apa type data yang hanya memiliki dua nilai?|Boolean
Apa type data yang memiliki bilangan real dan imajiner?|Complex
Apa type data yang berisi karakter atau teks?|String
Apa type data yang berisi kumpulan karakter?|Slice
Apa type data yang berisi kumpulan data dengan key dan value?|Map
Apa type data yang berisi kumpulan data dengan tipe data yang sama?|Array
Apa type data yang berisi bilangan bulat positif dan negatif?|Integer
Apa type data yang berisi bilangan bulat positif saja?|Uint
Apa type data yang berisi bilangan desimal positif dan negatif?|Float
Type data Integer dibagi menjadi apa saja?|Int8; Int16; Int32; Int64
Type data Uint dibagi menjadi apa saja?|Uint8; Uint16; Uint32; Uint64
Type data Float dibagi menjadi apa saja?|Float32; Float64
Type data Complex dibagi menjadi apa saja?|Complex64; Complex128
Uint digunakan untuk bilangan bulat apa?|Positif
Int digunakan untuk bilangan bulat apa?|Negatif dan Positif
Float digunakan untuk bilangan desimal apa?|Positif dan Negatif
Apa penanda untuk tipe data string?|menggunakan tanda kutip(" "/ ' '/ ` `)
Apa penanda untuk type data integer?|tidak menggunakan tanda kutip dan hanya berisi angka
Apa penanda untuk type data float?|tidak menggunakan tanda kutip dan berisi angka dengan koma
Apa penanda untuk type data boolean?|berisi true atau false
Apa itu type data Interface?|Sebuah tipe data yang berisi kumpulan method
Apa itu type data Struct?|Sebuah tipe data yang berisi kumpulan field
Apa itu type data Pointer?|Sebuah tipe data yang berisi alamat memori
Apa itu type data Range?|Sebuah tipe data yang berisi kumpulan data dengan index
Apa itu type data Slice?|Sebuah tipe data yang berisi kumpulan data dengan panjang dinamis
Apa itu type data Map?|Sebuah tipe data yang berisi kumpulan data dengan key dan value
Apa itu type data Array?|Sebuah tipe data yang berisi kumpulan data dengan tipe data yang sama
Berapa jumlah tipe data dasar pada go-lang?|sebelas
Berapa panjang tipe data string?|Tidak terbatas
Berapa panjang tipe data int8?|8 bit
Berapa rentang tipe data int8?|-128 sampai 127
Berapa panjang tipe data int16?|16 bit
Berapa rentang tipe data int16?|-32768 sampai 32767
Berapa panjang tipe data int32?|32 bit
Berapa rentang tipe data int32?|-2147483648 sampai 2147483647
Berapa panjang tipe data int64?|64 bit
Berapa rentang tipe data int64?|-9223372036854775808 sampai 9223372036854775807
Berapa panjang tipe data uint8?|8 bit
Berapa rentang tipe data uint8?|0 sampai 255
Berapa panjang tipe data uint16?|16 bit
Berapa rentang tipe data uint16?|0 sampai 65535
Berapa panjang tipe data uint32?|32 bit
Berapa rentang tipe data uint32?|0 sampai 4294967295
Berapa panjang tipe data uint64?|64 bit
Berapa rentang tipe data uint64?|0 sampai 18446744073709551615
Apa type data untuk waktu pada go-lang?|Time
Apa type data untuk tanggal pada go-lang?|Date
Apa type data untuk waktu dan tanggal pada go-lang?|DateTime
Apa itu Int pada go-lang?|Tipe data integer
Apa itu Uint pada go-lang?|Tipe data integer positif
Apa itu Float pada go-lang?|Tipe data desimal
Apa itu Complex pada go-lang?|Tipe data bilangan real dan imajiner
Apa itu String pada go-lang?|Tipe data karakter atau teks
Apa itu bool pada go-lang?|Tipe data boolean
Apa itu Any pada go-lang?|Tipe data apapun
Any bernilai apa pada go-lang?|Interface{}
Bagaimana jika ingin membuat tipe data sendiri pada go-lang?|Menggunakan keyword type
Apa itu tipe data kustom pada go-lang?|Tipe data yang dibuat sendiri
Apa itu tipe data alias pada go-lang?|Tipe data yang memiliki nama lain
Apa itu tipe data anonim pada go-lang?|Tipe data yang tidak memiliki nama
Apa itu tipe data built-in pada go-lang?|Tipe data yang sudah ada
Apa itu tipe data non-built-in pada go-lang?|Tipe data yang dibuat sendiri
Interface{} memiliki type alias apa?|Any
Apa type data untuk nilai error pada go-lang?|Error
Apa itu type data error pada go-lang?|Sebuah tipe data yang berisi pesan error
Apa yang terjadi jika type data error tidak dihandle?|Program akan berhenti
Apa yang terjadi jika type string dibuat tanpa tanda kutip?|akan Error
Apa yang terjadi jika type integer dibuat dengan tanda kutip?|akan dianggap String
Apa yang terjadi jika type float dibuat dengan tanda kutip?|akan dianggap String
Apa yang terjadi jika type boolean dibuat dengan tanda kutip?|akan dianggap String
Apa perbedaan type data int dan uint?|int memiliki nilai negatif dan positif; uint hanya memiliki nilai positif
Apa itu type data rune pada go-lang?|Sebuah tipe data alias dari int32
Apa itu type data byte pada go-lang?|Sebuah tipe data alias dari uint8
Apa itu type data uintptr pada go-lang?|Sebuah tipe data yang berisi alamat memori
Apa itu type data nil pada go-lang?|Sebuah tipe data yang berisi nilai kosong
Apakah type data nil memiliki type?|Tidak; hanya memiliki value
Bagaimana mengkonversi type data integer ke string?|Menggunakan strconv.Itoa()
Bagaimana mengkonversi type data string ke integer?|Menggunakan strconv.Atoi()
Bagaimana mengkonversi type data float ke string?|Menggunakan strconv.FormatFloat()
Bagaimana mengkonversi type data string ke float?|Menggunakan strconv.ParseFloat()
Bagaimana mengkonversi type data boolean ke string?|Menggunakan strconv.FormatBool()
Bagaimana mengkonversi type data string ke boolean?|Menggunakan strconv.ParseBool()
Bagaimana mengkonversi type data integer ke float?|Menggunakan float64()
Bagaimana mengkonversi type data float ke integer?|Menggunakan int()
Bagaimana mengkonversi type data integer ke uint?|Menggunakan uint()
Bagaimana mengkonversi type data uint ke integer?|Menggunakan int()
Apa itu type data complex pada go-lang?|Sebuah tipe data yang berisi bilangan real dan imajiner
Bagaimana mengkonversi type data integer ke complex?|Menggunakan complex()
Bagaimana mengkonversi type data float ke complex?|Menggunakan complex()
Bagaimana mengkonversi type data complex ke integer?|Menggunakan real()
Bagaimana mengkonversi type data complex ke float?|Menggunakan imag()
Bagaimana mengkonversi type data complex ke string?|Menggunakan fmt.Sprintf()
Bagaimana mengkonversi type data string ke complex?|Menggunakan fmt.Sscanf()
Apa yang terjadi jika type data integer dikonversi ke float?|akan menjadi bilangan desimal
Apa yang terjadi jika type data float dikonversi ke integer?|akan menjadi bilangan bulat
Apa yang terjadi jika type data integer dikonversi ke uint?|akan menjadi bilangan bulat positif
Apa yang terjadi jika type data uint dikonversi ke integer?|akan menjadi bilangan bulat positif/negatif
Apa yang terjadi jika type data integer dikonversi ke complex?|akan menjadi bilangan real
Apa yang terjadi jika type data float dikonversi ke complex?|akan menjadi bilangan real
Apa yang terjadi jika type data complex dikonversi ke integer?|akan menjadi bilangan bulat
Apa yang terjadi jika type data complex dikonversi ke float?|akan menjadi bilangan desimal
Apa yang terjadi jika mengkonversi type data string non-numeric ke integer?|akan error
Apa yang terjadi jika mengkonversi type data string non-numeric ke float?|akan error
Apa perbedaan Array dan Slice pada go-lang?|Array memiliki panjang tetap; Slice memiliki panjang dinamis
Apa perbedaan Array dan Map pada go-lang?|Array memiliki index; Map memiliki key
Apa perbedaan Array dan Struct pada go-lang?|Array memiliki tipe data sama; Struct memiliki tipe data berbeda
Apakah Array bisa diubah panjangnya?|Tidak; harus membuat array baru
Apakah Slice bisa diubah panjangnya?|Bisa; menggunakan append()
Apakah Map bisa diubah panjangnya?|Bisa; menggunakan delete()
Apakah Struct bisa diubah panjangnya?|Tidak; harus membuat struct baru
Apakah Array bisa diubah isinya?|Bisa; menggunakan index
Apakah Slice bisa diubah isinya?|Bisa; menggunakan index
Apakah Map bisa diubah isinya?|Bisa; menggunakan key
Apakah Struct bisa diubah isinya?|Bisa; menggunakan field
Apakah Array bisa dihapus isinya?|Tidak; harus membuat array baru
Apakah Slice bisa dihapus isinya?|Bisa; menggunakan append()
Apakah Map bisa dihapus isinya?|Bisa; menggunakan delete()
Apakah Struct bisa dihapus isinya?|Bisa; menggunakan field
Apakah Array bisa dihapus panjangnya?|Tidak; harus membuat array baru
Apakah Slice bisa dihapus panjangnya?|Bisa; menggunakan append()
Apakah Map bisa dihapus panjangnya?|Bisa; menggunakan delete()
Apakah Struct bisa dihapus panjangnya?|Tidak; harus membuat struct baru
Apakah Go memiliki tipe data untuk merepresentasikan tanggal dan waktu?|Ya menggunakan time.Time
Apakah Go memiliki type data untuk merepresentasikan binary data?|Ya menggunakan []byte
Apakah type data struct dapat berisi type data yang sama di dalamnya?|Ya; menggunakan pointer
Apakah Go memiliki tipe data untuk merepresentasikan bilangan kompleks?|Ya menggunakan complex64 dan complex128
Apakah Go memiliki tipe data untuk merepresentasikan bilangan bulat?|Ya menggunakan int8; int16; int32; int64; uint8; uint16; uint32; uint64
Apakah Go memiliki tipe data untuk merepresentasikan bilangan pecahan?|Ya menggunakan float32 dan float64
Apakah Go memiliki tipe data untuk merepresentasikan bilangan positif dan negatif?|Ya menggunakan int8; int16; int32; int64; float32; float64
Apakah Go memiliki tipe data untuk merepresentasikan bilangan positif saja?|Ya menggunakan uint8; uint16; uint32; uint64
Apakah Go memiliki tipe data untuk merepresentasikan bilangan real dan imajiner?|Ya menggunakan complex64 dan complex128
Apakah Go memiliki tipe data untuk merepresentasikan bilangan desimal?|Ya menggunakan float32 dan float64
Bagaimana membuat type data untuk parameter pada fungsi?|Menggunakan nama type data yang disediakan oleh go-lang seperti int; string; float; boolean; complex
Bagaimana membuat type data untuk return value pada fungsi?|Menggunakan nama type data yang disediakan oleh go-lang seperti int; string; float; boolean; complex
Bagaimana membuat type data untuk variabel?|Menggunakan nama type data yang disediakan oleh go-lang seperti int; string; float; boolean; complex
Apakah bisa menggunakan type data lain untuk parameter pada fungsi?|Bisa; menggunakan type data kustom
Apakah bisa menggunakan type data lain untuk return value pada fungsi?|Bisa; menggunakan type data kustom
Apakah bisa menggunakan type data lain untuk variabel?|Bisa; menggunakan type data kustom
Bagaimana membuat type data kustom pada go-lang?|Menggunakan keyword type dan nama type data yang diinginkan diikuti dengan Isi dari type data yang diinginkan
Bagaimana mambuat type data untuk parameter di fungsi?|Menggunakan nama parameter lalu diikuti nama type data yang diinginkan disebelahnya
Bagaimana mambuat type data untuk return value di fungsi?|Menggunakan nama return value lalu diikuti nama type data yang diinginkan disebelahnya
Bagaimana mambuat type data untuk variabel?|Menggunakan nama variabel lalu diikuti nama type data yang diinginkan disebelahnya
Apakah bisa menggunakan type data kustom untuk parameter di fungsi?|Bisa jika sudah dibuat
Apakah bisa membuat type data alias untuk type data kustom?|Bisa; dengan membuat nama alias lalu diikuti dengan type datanya
Bagaimana jika parameter memiliki type data yang sama berurutan pada fungsi?|Bisa dengan memberikan nama type data yang sama satu persatu atau memberikan type data pada parameter terakhir saja
Bagaimana membuat type data pada return value?|bisa memberikan nama type data saja atau juga bisa menambahkan alias untuk type datanya
Apa perbedaan antara array dan slice dalam Go?|Array memiliki panjang tetap; Slice memiliki panjang dinamis
Bagaimana cara menginisialisasi sebuah map dalam Go?|Menggunakan keyword var lalu diikuti nama variabel dan type data map
Apa itu tipe data interface kosong (interface{}) dalam Go dan bagaimana cara menggunakannya?|Sebuah tipe data yang berisi kumpulan method; menggunakan keyword interface{} lalu diikuti nama method
Apa kegunaan dari tipe data pointer dalam Go?|Sebuah tipe data yang berisi alamat memori
Bagaimana cara mengkonversi tipe data pointer ke tipe data non-pointer dalam Go?|Menggunakan tanda * diikuti nama type data
Apa yang dimaksud dengan tipe data channel dalam Go dan bagaimana cara penggunaannya?|Sebuah tipe data yang berisi kumpulan data; menggunakan keyword chan lalu diikuti nama type data
Bagaimana cara menggunakan tipe data struct dalam Go untuk merepresentasikan data yang kompleks?|Menggunakan keyword struct lalu diikuti nama field
Apa itu tipe data rune dalam Go dan kapan sebaiknya digunakan?|Sebuah tipe data alias dari int32; digunakan untuk merepresentasikan karakter
Bagaimana cara membuat tipe data alias (alias type) dalam Go?|Menggunakan keyword type lalu diikuti nama alias dan type data yang diinginkan
Apa perbedaan antara tipe data integer dengan tipe data floating point dalam Go?|Integer berisi bilangan bulat; Floating point berisi bilangan desimal
Bagaimana cara menggunakan tipe data time.Time untuk memanipulasi waktu dalam Go?|Menggunakan keyword time lalu diikuti nama method
Apa itu tipe data byte dalam Go dan kapan sebaiknya digunakan?|Sebuah tipe data alias dari uint8; digunakan untuk merepresentasikan data binary
Bagaimana cara mengubah tipe data antara string; integer; dan floating point dalam Go?|Menggunakan package strconv
Apa itu tipe data error dan bagaimana cara menggunakannya dalam pemrograman Go?|Sebuah tipe data yang berisi pesan error; menggunakan keyword error
Bagaimana cara membuat tipe data custom (kustom) dengan metode penerusan (embedding) dalam Go?|Menggunakan keyword type lalu diikuti nama type data yang diinginkan diikuti dengan type data yang diinginkan
Bagaimana cara menginisialisasi sebuah slice kosong dalam Go?|Menggunakan keyword var lalu diikuti nama variabel dan type data slice
Apa yang dimaksud dengan casting tipe data dalam Go?|Casting tipe data adalah proses mengubah nilai dari satu tipe data ke tipe data lain yang sesuai
Apa kegunaan dari tipe data pointer dalam Go?|Tipe data pointer digunakan untuk menyimpan alamat memori dari suatu nilai; memungkinkan kita untuk mengakses dan memanipulasi nilai tersebut secara langsung di lokasi memori
Bagaimana cara mengkonversi tipe data pointer ke tipe data non-pointer dalam Go?|Anda dapat mengkonversi tipe data pointer ke tipe data non-pointer dengan menggunakan operator dereference (*)
Apa yang dimaksud dengan tipe data channel dalam Go dan bagaimana cara penggunaannya?|Tipe data channel adalah tipe data yang digunakan untuk mengirim dan menerima data antara goroutine
Bagaimana cara menggunakan tipe data struct dalam Go untuk merepresentasikan data yang kompleks?|Anda dapat menggunakan tipe data struct untuk merepresentasikan data yang kompleks dengan mendefinisikan struktur data yang terdiri dari beberapa field
Apa itu tipe data rune dalam Go dan kapan sebaiknya digunakan?|Tipe data rune adalah tipe data yang digunakan untuk merepresentasikan karakter Unicode; tipe data ini sebaiknya digunakan ketika Anda ingin bekerja dengan karakter yang tidak terbatas pada ASCII
Bagaimana cara membuat tipe data alias (alias type) dalam Go?|Anda dapat membuat tipe data alias dengan menggunakan keyword type diikuti dengan nama alias dan tipe data yang ingin di-alias
Apa perbedaan antara tipe data integer dengan tipe data floating point dalam Go?|Tipe data integer digunakan untuk merepresentasikan bilangan bulat; sementara tipe data floating point digunakan untuk merepresentasikan bilangan desimal
Bagaimana cara menggunakan tipe data time.Time untuk memanipulasi waktu dalam Go?|Anda dapat menggunakan tipe data time.Time untuk memanipulasi waktu dalam Go dengan menggunakan metode-metode yang disediakan oleh package time
Apa itu tipe data byte dalam Go dan kapan sebaiknya digunakan?|Tipe data byte adalah tipe data yang digunakan untuk merepresentasikan data binary; tipe data ini sebaiknya digunakan ketika Anda ingin bekerja dengan data binary seperti file atau protokol jaringan
Bagaimana cara mengubah tipe data antara string; integer; dan floating point dalam Go?|Anda dapat mengubah tipe data antara string; integer; dan floating point dalam Go dengan menggunakan package strconv
Apa itu tipe data error dan bagaimana cara menggunakannya dalam pemrograman Go?|Tipe data error adalah tipe data yang digunakan untuk merepresentasikan pesan error; tipe data ini sebaiknya digunakan ketika Anda ingin menangani kesalahan dalam program Anda
Bagaimana cara membuat tipe data custom (kustom) dengan metode penerusan (embedding) dalam Go?|Anda dapat membuat tipe data custom dengan metode penerusan (embedding) dalam Go dengan menggunakan keyword type diikuti dengan nama type data yang diinginkan diikuti dengan type data yang diinginkan
Bagaimana cara menginisialisasi sebuah slice kosong dalam Go?|Anda dapat menginisialisasi sebuah slice kosong dalam Go dengan menggunakan keyword var diikuti dengan nama variabel dan type data slice
Apa yang dimaksud dengan casting tipe data dalam Go?|Casting tipe data adalah proses mengubah nilai dari satu tipe data ke tipe data lain yang sesuai
kenapa tipe data error harus dihandle?|Karena jika tidak dihandle, program akan berhenti
kenapa tipe data string harus menggunakan tanda kutip?|Karena tanda kutip menandakan bahwa data tersebut adalah string
kenapa tipe data integer tidak boleh menggunakan tanda kutip?|Karena tanda kutip menandakan bahwa data tersebut adalah string
kenapa tipe data float tidak boleh menggunakan tanda kutip?|Karena tanda kutip menandakan bahwa data tersebut adalah string
kenapa tipe data boolean tidak boleh menggunakan tanda kutip?|Karena tanda kutip menandakan bahwa data tersebut adalah string
kenapa tipe data string tidak boleh menggunakan angka?|Karena angka menandakan bahwa data tersebut adalah integer
kenapa tipe data integer tidak boleh menggunakan huruf?|Karena huruf menandakan bahwa data tersebut adalah string
kenapa tipe data float tidak boleh menggunakan huruf?|Karena huruf menandakan bahwa data tersebut adalah string
kenapa tipe data boolean tidak boleh menggunakan huruf?|Karena huruf menandakan bahwa data tersebut adalah string
kenapa tipe data integer tidak boleh menggunakan koma?|Karena koma menandakan bahwa data tersebut adalah float
kenapa tipe data float tidak boleh menggunakan titik?|Karena titik menandakan bahwa data tersebut adalah float
kenapa tipe data boolean tidak boleh menggunakan titik?|Karena titik menandakan bahwa data tersebut adalah float
kenapa tipe data string tidak boleh menggunakan tanda kurung?|Karena tanda kurung menandakan bahwa data tersebut adalah array
kenapa tipe data integer tidak boleh menggunakan tanda kurung?|Karena tanda kurung menandakan bahwa data tersebut adalah array
kenapa tipe data float tidak boleh menggunakan tanda kurung?|Karena tanda kurung menandakan bahwa data tersebut adalah array
kenapa tipe data boolean tidak boleh menggunakan tanda kurung?|Karena tanda kurung menandakan bahwa data tersebut adalah array
kenapa tipe data string tidak boleh menggunakan tanda kurung kurawal?|Karena tanda kurung kurawal menandakan bahwa data tersebut adalah map
kenapa tipe data integer tidak boleh menggunakan tanda kurung kurawal?|Karena tanda kurung kurawal menandakan bahwa data tersebut adalah map
kenapa tipe data float tidak boleh menggunakan tanda kurung kurawal?|Karena tanda kurung kurawal menandakan bahwa data tersebut adalah map
kenapa tipe data boolean tidak boleh menggunakan tanda kurung kurawal?|Karena tanda kurung kurawal menandakan bahwa data tersebut adalah map
kenapa tipe data string tidak boleh menggunakan tanda kurung siku?|Karena tanda kurung siku menandakan bahwa data tersebut adalah slice
kenapa tipe data integer tidak boleh menggunakan tanda kurung siku?|Karena tanda kurung siku menandakan bahwa data tersebut adalah slice
kenapa tipe data float tidak boleh menggunakan tanda kurung siku?|Karena tanda kurung siku menandakan bahwa data tersebut adalah slice
kenapa tipe data boolean tidak boleh menggunakan tanda kurung siku?|Karena tanda kurung siku menandakan bahwa data tersebut adalah slice
kenapa tipe data string tidak boleh menggunakan tanda petik?|Karena tanda petik menandakan bahwa data tersebut adalah string
kenapa tipe data integer tidak boleh menggunakan tanda petik?|Karena tanda petik menandakan bahwa data tersebut adalah string
kenapa tipe data float tidak boleh menggunakan tanda petik?|Karena tanda petik menandakan bahwa data tersebut adalah string
kenapa tipe data boolean tidak boleh menggunakan tanda petik?|Karena tanda petik menandakan bahwa data tersebut adalah string
kenapa tipe data string tidak boleh menggunakan tanda petik satu?|Karena tanda petik satu menandakan bahwa data tersebut adalah string
kenapa tipe data integer tidak boleh menggunakan tanda petik satu?|Karena tanda petik satu menandakan bahwa data tersebut adalah string
kenapa tipe data float tidak boleh menggunakan tanda petik satu?|Karena tanda petik satu menandakan bahwa data tersebut adalah string
kenapa tipe data boolean tidak boleh menggunakan tanda petik satu?|Karena tanda petik satu menandakan bahwa data tersebut adalah string
kenapa tipe data string tidak boleh menggunakan tanda petik dua?|Karena tanda petik dua menandakan bahwa data tersebut adalah string
kenapa tipe data integer tidak boleh menggunakan tanda petik dua?|Karena tanda petik dua menandakan bahwa data tersebut adalah string
kenapa tipe data float tidak boleh menggunakan tanda petik dua?|Karena tanda petik dua menandakan bahwa data tersebut adalah string
kenapa tipe data boolean tidak boleh menggunakan tanda petik dua?|Karena tanda petik dua menandakan bahwa data tersebut adalah string
kenapa tipe data string tidak boleh menggunakan tanda petik satu dan dua?|Karena tanda petik satu dan dua menandakan bahwa data tersebut adalah string
kenapa tipe data integer tidak boleh menggunakan tanda petik satu dan dua?|Karena tanda petik satu dan dua menandakan bahwa data tersebut adalah string
kenapa tipe data float tidak boleh menggunakan tanda petik satu dan dua?|Karena tanda petik satu dan dua menandakan bahwa data tersebut adalah string
kenapa tipe data boolean tidak boleh menggunakan tanda petik satu dan dua?|Karena tanda petik satu dan dua menandakan bahwa data tersebut adalah string
kenapa tipe data string tidak boleh menggunakan tanda kutip satu dan dua?|Karena tanda kutip satu dan dua menandakan bahwa data tersebut adalah string
kenapa tipe data integer tidak boleh menggunakan tanda kutip satu dan dua?|Karena tanda kutip satu dan dua menandakan bahwa data tersebut adalah string
kenapa tipe data float tidak boleh menggunakan tanda kutip satu dan dua?|Karena tanda kutip satu dan dua menandakan bahwa data tersebut adalah string
kenapa tipe data boolean tidak boleh menggunakan tanda kutip satu dan dua?|Karena tanda kutip satu dan dua menandakan bahwa data tersebut adalah string
untuk apa tipe data string digunakan?|Tipe data string digunakan untuk merepresentasikan teks atau karakter
untuk apa tipe data integer digunakan?|Tipe data integer digunakan untuk merepresentasikan bilangan bulat
untuk apa tipe data float digunakan?|Tipe data float digunakan untuk merepresentasikan bilangan desimal
untuk apa tipe data boolean digunakan?|Tipe data boolean digunakan untuk merepresentasikan nilai kebenaran (true atau false)
untuk apa tipe data complex digunakan?|Tipe data complex digunakan untuk merepresentasikan bilangan kompleks
untuk apa tipe data rune digunakan?|Tipe data rune digunakan untuk merepresentasikan karakter Unicode
untuk apa tipe data byte digunakan?|Tipe data byte digunakan untuk merepresentasikan data binary
untuk apa tipe data uintptr digunakan?|Tipe data uintptr digunakan untuk merepresentasikan alamat memori
untuk apa tipe data nil digunakan?|Tipe data nil digunakan untuk merepresentasikan nilai kosong
untuk apa tipe data error digunakan?|Tipe data error digunakan untuk merepresentasikan pesan error
untuk apa tipe data interface{} digunakan?|Tipe data interface{} digunakan untuk merepresentasikan kumpulan method
untuk apa tipe data struct digunakan?|Tipe data struct digunakan untuk merepresentasikan kumpulan field
untuk apa tipe data pointer digunakan?|Tipe data pointer digunakan untuk merepresentasikan alamat memori
untuk apa tipe data range digunakan?|Tipe data range digunakan untuk merepresentasikan kumpulan data dengan index
untuk apa tipe data slice digunakan?|Tipe data slice digunakan untuk merepresentasikan kumpulan data dengan panjang dinamis
untuk apa tipe data map digunakan?|Tipe data map digunakan untuk merepresentasikan kumpulan data dengan key dan value
untuk apa tipe data array digunakan?|Tipe data array digunakan untuk merepresentasikan kumpulan data dengan tipe data yang sama
untuk apa tipe data time digunakan?|Tipe data time digunakan untuk merepresentasikan waktu
untuk apa tipe data date digunakan?|Tipe data date digunakan untuk merepresentasikan tanggal
untuk apa tipe data datetime digunakan?|Tipe data datetime digunakan untuk merepresentasikan waktu dan tanggal
untuk apa tipe data any digunakan?|Tipe data any digunakan untuk merepresentasikan tipe data apapun
untuk apa tipe data rune digunakan?|Tipe data rune digunakan untuk merepresentasikan karakter Unicode
untuk apa tipe data byte digunakan?|Tipe data byte digunakan untuk merepresentasikan data binary
apakah fungsi itu tipe data pada go-lang?|Tidak; fungsi adalah blok kode yang dapat dipanggil oleh program
apakah variabel itu tipe data pada go-lang?|Tidak; variabel adalah tempat untuk menyimpan data
apakah konstanta itu tipe data pada go-lang?|Tidak; konstanta adalah nilai yang tidak dapat diubah
